{"contract_version":"v3","service":"dewey","environment":"day","instance_id":"47270698905e42238deafabfce2d16e6","observed_at":"2026-09-16T19:01:45.078543+00:00","status":"ok","request_id":"a19l-LO9MvPuB5sPzHffjFWWSdvzntHU","correlation_id":"bfcca6686b16992c","build":{"version":"10.0.5","sha":"df6d4d0646fc1385c35ff2b6353478a46b4587ac"},"checks":{"process":{"status":"ok","started_at":"2026-09-13T07:47:32.603717+00:00"}},"projection":{"state":"ready","stale":false,"observed_at":"2026-09-16T19:01:45.078543+00:00","last_synced_at":"2026-09-16T19:01:45.078543+00:00","detail":null}}